{"blockers":[],"criteria":[{"evidence":"4 executable checks passed: NORMATIVE_FILES_PRESENT, AUTHORITATIVE_PDF_HASHES, JSON_SCHEMAS_VALID, SCHEMA_EXAMPLES_VALID","id":"G0_NORMATIVE_FILES_VALID","passed":true},{"evidence":"7 executable checks passed: SEAL_SCHEMA_VALID, SEAL_VERSION, SEAL_TIME, SEAL_PREDECESSOR_CHAIN, SEAL_PROTOCOL_ID_VERSION, SEAL_FILE_LIST, SEAL_ROOT","id":"G0_PROTOCOL_SEAL_VERIFIES","passed":true},{"evidence":"7 executable checks passed: PROTOCOL_ID_VERSION, PROTOCOL_FROZEN, AUXILIARY_DOCUMENT_VERSIONS, AUTHORITY_DOMAINS_SPLIT, GATES_COMPLETE, GATE_CRITERIA_CATALOG_CLOSED, RELEASE_DECISION_ORDER_EXCLUSIVE","id":"G0_PROTOCOL_COMPONENTS_FROZEN","passed":true},{"evidence":"4 executable checks passed: PRODUCTION_SPLIT_SALT_COMMITTED_ONLY, CLARIFICATION_CUSTODY_BOUNDARY, CUSTODY_ROLES_GATED, CUSTODY_SYNTHETIC_DRY_RUN","id":"G0_CUSTODY_DRY_RUN","passed":true},{"evidence":"28 executable checks passed: METRIC_IDS_UNIQUE, ENDPOINT_HIERARCHY_CLOSED, METRIC_SCOPE_UNITS_BOUNDS_CLOSED, METRIC_SCHEMAS_SCOPE_CLOSED, CLASSES_AND_DENOMINATORS_CLOSED, ELIGIBILITY_TOPOLOGY_STATES_EXACT, ELIGIBILITY_OUTCOME_FIREWALL, ELIGIBILITY_REQUIRES_P2A_FIELDS, CONFIRMATION_TARGETS_EXACT, N300_COMPOSITION_EXACT, COHORT_NESTING_COUNTS, PUBLIC_SEEDS_256_BIT, SELECTION_AND_SPLIT_SPECS_CLOSED, EXECUTION_RESTART_GUARDS_CLOSED, EXACT_BLOCKERS_SEPARATED, HOLM_PRIMARY_FAMILIES_EXACT, AI_AUTHORIZATION_EXECUTABLE, POPULATION_INFERENCE_BOUNDED, SYSTEMATIC_DISADVANTAGE_EXACT, ERROR_TAXONOMY_CLOSED, CLARIFICATION_PHASE_ORDER, CLARIFICATION_CLAIM_BOUNDARY, PREDECESSOR_ARCHIVE_CHAIN_VALID, LOCAL_SOURCE_CLOSURE_SEALED, GATE_VERDICT_CONTRACT_CLOSED, CALIBRATION_FREEZE_CONTRACT_CLOSED, FROZEN_SPLIT_VECTOR_EXECUTES, PRODUCTION_SELECTION_SPLIT_EXECUTES","id":"G0_SEMANTIC_CLOSURE","passed":true}],"deviations":["Blind custody is process-locked access control with a schema-validated synthetic dry run; it is not human double blinding. Production private storage and the production split salt are not claimed as provisioned at G0 and are required before G1.","Independent technical, anatomy and statistical reviewers plus the clean-room implementation owner are future gate roles. They are not claimed as provisioned at G0 and block the later gates stated in roles.yaml when absent."],"evidence_hashes":{"seal.json":"83c3a6ab4c215dfa416c88e910bb138d6ebd4ad97fdb882bdf036a55585cb8e8"},"gate":"G0","protocol_root_sha256":"a600436d8a51ee3c26a6070ead19829cc3568a257493a5c639c35e5a35b8a9e7","schema_version":"0.1.0","verdict":"PASS"}
