{"blockers":[],"criteria":[{"evidence":"all normative files present","id":"NORMATIVE_FILES_PRESENT","passed":true},{"evidence":"protocol_version='1.0.0-p0'","id":"PROTOCOL_ID_VERSION","passed":true},{"evidence":"status='FROZEN'","id":"PROTOCOL_FROZEN","passed":true},{"evidence":"metrics=28, unique=28","id":"METRIC_DICTIONARY_UNIQUE","passed":true},{"evidence":"all primary endpoints are defined","id":"PRIMARY_ENDPOINTS_DEFINED","passed":true},{"evidence":"three 256-bit lowercase hexadecimal values","id":"SPLIT_SEEDS_256_BIT","passed":true},{"evidence":"algorithm, formula, weights, tie-break and test vectors are present","id":"SPLIT_ALGORITHM_EXACT","passed":true},{"evidence":"codes=28, unique=28","id":"ERROR_CODES_UNIQUE","passed":true},{"evidence":"gates=['G0', 'G1', 'G2', 'G3', 'G4', 'G5', 'G6', 'G7']","id":"GATES_COMPLETE","passed":true},{"evidence":"roles=['anatomy_adjudicator', 'holdout_custodian', 'holdout_unlock_authority', 'maintainer_and_final_decision_authority', 'protocol_custodian', 'second_implementation_owner', 'statistical_reviewer', 'technical_adjudicator']","id":"ROLES_ASSIGNED","passed":true},{"evidence":"three source PDFs match","id":"AUTHORITATIVE_INPUT_HASHES","passed":true},{"evidence":"8 Draft 2020-12 schemas valid","id":"JSON_SCHEMAS_VALID","passed":true},{"evidence":"seal file list and individual SHA-256 values match","id":"SEAL_FILE_LIST","passed":true},{"evidence":"protocol_root_sha256=87f74f8196c3f9b3c7f512a8a4a1b04d17743428ef91982e4b6f2da29087cf9f","id":"SEAL_ROOT","passed":true}],"deviations":["Holdout custody roles are specified but must be provisioned and dry-run before G5.","Independent human and clean-room implementation roles remain future gate requirements, not G0 blockers."],"evidence_hashes":{"seal.json":"7d68ceddd47322b27b76b1fe8a7ef83cbdc5903f8e801cdd61e38cdc4953f6e0"},"gate":"G0","protocol_root_sha256":"87f74f8196c3f9b3c7f512a8a4a1b04d17743428ef91982e4b6f2da29087cf9f","schema_version":"0.1.0","verdict":"PASS"}
